{
  "schema_version": "kgnote.graph-read-model.v1",
  "snapshot_sha256": "9fe29c60b397fb78179a7d6c19be747b19b7d4bb1ec634b497f5b7c213046d68",
  "nodes": [
    {"id":"concept_010718e5930570467930dd014f2f36fe79423cc95f8280ae614738058887848c","kind":"concept","label":"Flask 路由","aliases":["Flask route","route","routing table"],"spaces":["bitepacer-networking"],"summary":"Flask 用路徑把收到的 HTTP 請求交給對應 Python function 處理的規則。","status":"needs_review","evidence_ids":["evidence_3a0f087ea18e82057fe8900359d67ca3b527f7c1d260e05859b7cb0bfbfb97ce"]},
    {"id":"concept_29bc756291762577b4a5a056788f71b6fdb51df50792ba958cc8a49cccf3c563","kind":"concept","label":"本機回環位址","aliases":["127.0.0.1","localhost","loopback address"],"spaces":["bitepacer-networking"],"summary":"指向發出連線的那台主機自己；不同裝置的 127.0.0.1 各自指向自己。","status":"needs_review","evidence_ids":["evidence_aec121284936da67958355799c00ecda1d0e2f4e521ddc26c1d66b8e0fadb0ab"]},
    {"id":"concept_360e50eb00c9ea5f82793fa1d103b34ac2ce91d2e6d14f14459d89426fdbe8a5","kind":"concept","label":"HTTP 回應","aliases":["HTTP response","response"],"spaces":["bitepacer-networking"],"summary":"伺服器處理請求後傳回用戶端的結果。","status":"needs_review","evidence_ids":["evidence_3a0f087ea18e82057fe8900359d67ca3b527f7c1d260e05859b7cb0bfbfb97ce"]},
    {"id":"concept_470e5cac522d492b99b5530a908c36b412ee3b1f5ebd219b65421375720d5ec1","kind":"concept","label":"伺服器","aliases":["Server"],"spaces":["bitepacer-networking"],"summary":"等待請求、進行處理並回傳回應的一方；它描述程式角色，不是固定的電腦種類。","status":"needs_review","evidence_ids":["evidence_b1861d12c500f976ca0364f6ec0ac869851ab741a5cc2110cd5714c39d4f3bed"]},
    {"id":"concept_4979cd636c95b67d9e5b6db2cfb1f14fa06823cda1e0ddbc384d64f119c50704","kind":"concept","label":"ngrok 通道","aliases":["ngrok","ngrok tunnel"],"spaces":["bitepacer-networking"],"summary":"在這個 BitePacer 架構中，提供外界通往 Mac 本機 Flask 服務的公開路徑。","status":"needs_review","evidence_ids":["evidence_a0be170fb64697eda88e5ddaa74ef50ce40f2007b0f227cc9e8c1ca72c222939"]},
    {"id":"concept_ac75ffef5130f55c93c86161757813ed3ad92aadf3dd5344d742737031de97e2","kind":"concept","label":"HTTP 請求","aliases":["HTTP request","request"],"spaces":["bitepacer-networking"],"summary":"用戶端傳給伺服器、用來要求某個資源或操作的訊息。","status":"needs_review","evidence_ids":["evidence_3a0f087ea18e82057fe8900359d67ca3b527f7c1d260e05859b7cb0bfbfb97ce"]},
    {"id":"concept_c1f041f6fb10bdfb212b04abdc7294c95e2adc5b99f39f568a89a2b102898feb","kind":"concept","label":"IP 位址","aliases":["IP","IP address"],"spaces":["bitepacer-networking"],"summary":"在這份入門教材中，用來辨認要連線的主機。","status":"needs_review","evidence_ids":["evidence_86c0656b647b9501afd4dd7b807756584db51ea1114b6d68a75662209c0cc860"]},
    {"id":"concept_d18b2812af2ceef6d4d683eb766686b01b608336e89cc608b30c687218d858cf","kind":"concept","label":"用戶端","aliases":["Client"],"spaces":["bitepacer-networking"],"summary":"主動向另一個程式提出請求的一方；Chrome、LINE server 或 curl 都可能扮演用戶端。","status":"needs_review","evidence_ids":["evidence_b1861d12c500f976ca0364f6ec0ac869851ab741a5cc2110cd5714c39d4f3bed"]},
    {"id":"concept_ffaed4cca46d7aa7e4980dd7aa5509a73c69c46c6dfa6226b38a2d777e8632af","kind":"concept","label":"連接埠","aliases":["port"],"spaces":["bitepacer-networking"],"summary":"在一台主機上辨認要連到哪個網路服務的入口編號。","status":"needs_review","evidence_ids":["evidence_86c0656b647b9501afd4dd7b807756584db51ea1114b6d68a75662209c0cc860"]}
  ],
  "links": [
    {"id":"edge_14416de645cb7f873be16c9a19ed021a7f2e61a1b57ac28c08bd49b59be70a23","source_id":"concept_ffaed4cca46d7aa7e4980dd7aa5509a73c69c46c6dfa6226b38a2d777e8632af","target_id":"concept_010718e5930570467930dd014f2f36fe79423cc95f8280ae614738058887848c","relation":"related_to","edge_class":"canonical","confidence":"high","evidence_ids":["evidence_3a0f087ea18e82057fe8900359d67ca3b527f7c1d260e05859b7cb0bfbfb97ce","evidence_86c0656b647b9501afd4dd7b807756584db51ea1114b6d68a75662209c0cc860"]},
    {"id":"edge_33c3c2af37bc306d48f90d5bf6616edb6e5dc3de293d6ec52fc315c455613c86","source_id":"concept_470e5cac522d492b99b5530a908c36b412ee3b1f5ebd219b65421375720d5ec1","target_id":"concept_360e50eb00c9ea5f82793fa1d103b34ac2ce91d2e6d14f14459d89426fdbe8a5","relation":"related_to","edge_class":"canonical","confidence":"high","evidence_ids":["evidence_3a0f087ea18e82057fe8900359d67ca3b527f7c1d260e05859b7cb0bfbfb97ce","evidence_b1861d12c500f976ca0364f6ec0ac869851ab741a5cc2110cd5714c39d4f3bed"]},
    {"id":"edge_3852d91a3eb001ad73300521137f7cb6f05b16ef6ffe287fdae9afc75c61fea2","source_id":"concept_4979cd636c95b67d9e5b6db2cfb1f14fa06823cda1e0ddbc384d64f119c50704","target_id":"concept_010718e5930570467930dd014f2f36fe79423cc95f8280ae614738058887848c","relation":"related_to","edge_class":"canonical","confidence":"high","evidence_ids":["evidence_3a0f087ea18e82057fe8900359d67ca3b527f7c1d260e05859b7cb0bfbfb97ce","evidence_a0be170fb64697eda88e5ddaa74ef50ce40f2007b0f227cc9e8c1ca72c222939"]},
    {"id":"edge_6626ad4038e07657f0b204df174eb58ddaee5739914e39dc7e0ec98d36042e97","source_id":"concept_010718e5930570467930dd014f2f36fe79423cc95f8280ae614738058887848c","target_id":"concept_ac75ffef5130f55c93c86161757813ed3ad92aadf3dd5344d742737031de97e2","relation":"related_to","edge_class":"canonical","confidence":"high","evidence_ids":["evidence_3a0f087ea18e82057fe8900359d67ca3b527f7c1d260e05859b7cb0bfbfb97ce"]},
    {"id":"edge_80042c4f448d92b2d8311f064b6189e7259615ff1c0babd38bb817adcf561c4a","source_id":"concept_d18b2812af2ceef6d4d683eb766686b01b608336e89cc608b30c687218d858cf","target_id":"concept_ac75ffef5130f55c93c86161757813ed3ad92aadf3dd5344d742737031de97e2","relation":"related_to","edge_class":"canonical","confidence":"high","evidence_ids":["evidence_3a0f087ea18e82057fe8900359d67ca3b527f7c1d260e05859b7cb0bfbfb97ce","evidence_b1861d12c500f976ca0364f6ec0ac869851ab741a5cc2110cd5714c39d4f3bed"]},
    {"id":"edge_90a1b92e126e43975b3adcb9e9c54c8cf24d2f7e835784b793decb90435c75c8","source_id":"concept_29bc756291762577b4a5a056788f71b6fdb51df50792ba958cc8a49cccf3c563","target_id":"concept_c1f041f6fb10bdfb212b04abdc7294c95e2adc5b99f39f568a89a2b102898feb","relation":"is_a","edge_class":"canonical","confidence":"high","evidence_ids":["evidence_aec121284936da67958355799c00ecda1d0e2f4e521ddc26c1d66b8e0fadb0ab"]},
    {"id":"edge_aad5805e9a5690b8e3eef61e3a75c10ef74e0ecd90acfbfb1ec3d81886674cc3","source_id":"concept_010718e5930570467930dd014f2f36fe79423cc95f8280ae614738058887848c","target_id":"concept_360e50eb00c9ea5f82793fa1d103b34ac2ce91d2e6d14f14459d89426fdbe8a5","relation":"related_to","edge_class":"canonical","confidence":"high","evidence_ids":["evidence_3a0f087ea18e82057fe8900359d67ca3b527f7c1d260e05859b7cb0bfbfb97ce"]}
  ],
  "evidence": [
    {"id":"evidence_3a0f087ea18e82057fe8900359d67ca3b527f7c1d260e05859b7cb0bfbfb97ce","label":"Evidence L51-L66","source_id":"src_bitepacer_mini_network_lesson","locator":{"kind":"line_range","value":"L51-L66"},"proposition":"用戶端送出 HTTP request；Flask 依 route 找到 Python handler 處理，再產生 HTTP response 回傳。","observed_at":"2026-08-14T19:51:44+08:00","extractor_version":"manual.zh-bitepacer.v1","extraction_confidence":"high","review_status":"accepted"},
    {"id":"evidence_86c0656b647b9501afd4dd7b807756584db51ea1114b6d68a75662209c0cc860","label":"Evidence L20-L36","source_id":"src_bitepacer_mini_network_lesson","locator":{"kind":"line_range","value":"L20-L36"},"proposition":"在這份 BitePacer 入門教材中，IP 或 hostname 用來找到主機，port 用來找到該主機上的特定網路服務。","observed_at":"2026-08-14T19:51:44+08:00","extractor_version":"manual.zh-bitepacer.v1","extraction_confidence":"high","review_status":"accepted"},
    {"id":"evidence_a0be170fb64697eda88e5ddaa74ef50ce40f2007b0f227cc9e8c1ca72c222939","label":"Evidence L68-L84","source_id":"src_bitepacer_mini_network_lesson","locator":{"kind":"line_range","value":"L68-L84"},"proposition":"因為 Internet 上的 LINE server 無法用 127.0.0.1 連到 product owner 的 Mac，ngrok tunnel 提供從公開網址通往 Mac 本機 Flask 服務的路徑。","observed_at":"2026-08-14T19:51:44+08:00","extractor_version":"manual.zh-bitepacer.v1","extraction_confidence":"high","review_status":"accepted"},
    {"id":"evidence_aec121284936da67958355799c00ecda1d0e2f4e521ddc26c1d66b8e0fadb0ab","label":"Evidence L38-L49","source_id":"src_bitepacer_mini_network_lesson","locator":{"kind":"line_range","value":"L38-L49"},"proposition":"127.0.0.1 是本機回環位址，永遠指向提出連線的裝置自己；因此 LINE server 的 127.0.0.1 不是 product owner 的 Mac。","observed_at":"2026-08-14T19:51:44+08:00","extractor_version":"manual.zh-bitepacer.v1","extraction_confidence":"high","review_status":"accepted"},
    {"id":"evidence_b1861d12c500f976ca0364f6ec0ac869851ab741a5cc2110cd5714c39d4f3bed","label":"Evidence L3-L18","source_id":"src_bitepacer_mini_network_lesson","locator":{"kind":"line_range","value":"L3-L18"},"proposition":"用戶端是主動提出 request 的程式，伺服器是等待 request、處理後回傳 response 的程式；兩者是互動角色，不是固定的電腦種類。","observed_at":"2026-08-14T19:51:44+08:00","extractor_version":"manual.zh-bitepacer.v1","extraction_confidence":"high","review_status":"accepted"}
  ],
  "sources": [
    {"id":"src_bitepacer_mini_network_lesson","label":"BitePacer 驅動的迷你計網","source_kind":"chatgpt_conversation","captured_at":"2026-08-14T19:51:44+08:00","content_sha256":"bbef6549c2381ee729c355b69151777bbdbda459ca16079055316f52318792db"}
  ],
  "filter_facets": {
    "node_kinds": ["concept"],
    "edge_classes": ["canonical"],
    "relations": ["is_a", "related_to"],
    "spaces": ["bitepacer-networking"]
  }
}
